{
  "access": {
    "harbor": {
      "credential_source": "file:path:1f8b6bf528f9",
      "granted_actions": [
        "delete",
        "pull",
        "push"
      ],
      "identity": "spyroot",
      "origin": "https://harbor.dcloud.run",
      "repository": "hott/ci-skills-toolbox"
    },
    "kubernetes": {
      "context": "default/api-ww-cai-cisco-live-dcloud-local:6443/kube:admin",
      "identity": "kube:admin",
      "server": "https://api.ww-cai-cisco-live.dcloud.local:6443"
    }
  },
  "captured_at": "2026-10-13T06:37:12.443992+00:00",
  "cleanup": {
    "failures": [],
    "status": "PASS"
  },
  "errors": [],
  "filters": {},
  "kind": "toolbox",
  "operation": "update",
  "plan_digest": "7d5dc8b8d7bb1bfa0444d8ec3dde3e0832dfd2043d2f613fb6a6beb31b24171f",
  "records": [
    {
      "callback": "EnsureNamespace",
      "namespaces": [
        {
          "action": "NO_OP",
          "name": "ci-skills-pr67-a9ef7ff4",
          "uid": "cd7a25df-314b-43f4-a6e6-31bbf1719b6c"
        }
      ],
      "verified": true
    },
    {
      "app": "ci-skills-toolbox-pr67",
      "build_fingerprint": "3c74d722c519d1416015013c2f941cb6eac6a23d17c765184273ef6e257a05d8",
      "build_name": null,
      "callback": "HarborBuild",
      "digest": "sha256:ca1f0ba6940496d537c11e76b18c03138d3293f47fc1ea81c18426df2e7f1789",
      "image": "harbor.dcloud.run/hott/ci-skills-toolbox:ci-skills-build-4f1c1f8729dec1b999b26c83",
      "namespace": "ci-skills-pr67-a9ef7ff4",
      "reused": true,
      "specification_fingerprint": "4f1c1f8729dec1b999b26c836c3eff94edc98e49e36dad95d1cb3cef85af1a91",
      "verified": true
    }
  ],
  "schema_version": "1.0",
  "skill": {
    "algorithm": "sha256-tree-v1",
    "consuming_project": {
      "commit": null,
      "source": null
    },
    "digest": "ff9ebce1733492ac83a6e49a5c630260367c526d604142b761ea52d27be1aef8",
    "file_count": 139,
    "functional_digest": "37a22309da7bd79cc36ca1da4549f713cec7cf0a8f36ebf128bbfc6602a9461e",
    "revision": {
      "source": "installer_record",
      "value": "a9ef7ff49dbed26726f327a19485a9ab801fc9d7",
      "verified": true
    }
  },
  "status": "PASS",
  "summary": {
    "error_count": 0,
    "record_count": 2
  },
  "target": "path:5e5380df1eda",
  "tested_revision": "a9ef7ff49dbed26726f327a19485a9ab801fc9d7",
  "trace_artifact": "../traces/37-repeat.jsonl"
}
