{
  "access": {
    "harbor": {
      "credential_source": "file:path:1f8b6bf528f9",
      "granted_actions": [
        "delete",
        "pull",
        "push"
      ],
      "identity": "spyroot",
      "origin": "https://harbor.dcloud.run",
      "repository": "hott/ci-skills-toolbox"
    }
  },
  "captured_at": "2026-10-13T06:47:14.385795+00:00",
  "cleanup": {
    "failures": [],
    "status": "PASS"
  },
  "errors": [],
  "filters": {},
  "kind": "harbor_push",
  "operation": "push",
  "plan_digest": "d2cf4af9ff6887d176c533e1ed22ce7c0839269029735ea873f7b6e999b799af",
  "records": [
    {
      "action": "APPLIED",
      "callback": "HarborPush",
      "digest": "sha256:64af6d5d876e3520cdd2f00fe6af74c64cfed296b4edd103d44e31d2344df1dd",
      "image": "harbor.dcloud.run/hott/ci-skills-toolbox@sha256:64af6d5d876e3520cdd2f00fe6af74c64cfed296b4edd103d44e31d2344df1dd",
      "verified": true
    }
  ],
  "schema_version": "1.0",
  "skill": {
    "algorithm": "sha256-tree-v1",
    "consuming_project": {
      "commit": null,
      "source": null
    },
    "digest": "ff9ebce1733492ac83a6e49a5c630260367c526d604142b761ea52d27be1aef8",
    "file_count": 139,
    "functional_digest": "37a22309da7bd79cc36ca1da4549f713cec7cf0a8f36ebf128bbfc6602a9461e",
    "revision": {
      "source": "installer_record",
      "value": "a9ef7ff49dbed26726f327a19485a9ab801fc9d7",
      "verified": true
    }
  },
  "status": "PASS",
  "summary": {
    "error_count": 0,
    "record_count": 1
  },
  "target": "path:5e5380df1eda",
  "tested_revision": "a9ef7ff49dbed26726f327a19485a9ab801fc9d7",
  "trace_artifact": "../traces/31.jsonl"
}
