{
  "access": {
    "github": {
      "credential_source": "gh-credential-store:github.com",
      "host": "github.com",
      "identity": "spyroot",
      "repository": "spyroot/ci-skills",
      "repository_id": 1400051889
    },
    "harbor": {
      "credential_source": "file:path:1f8b6bf528f9",
      "granted_actions": [
        "delete",
        "pull",
        "push"
      ],
      "identity": "spyroot",
      "origin": "https://harbor.dcloud.run",
      "repository": "hott/ci-skills-toolbox"
    },
    "kubernetes": {
      "context": "default/api-ww-cai-cisco-live-dcloud-local:6443/kube:admin",
      "identity": "kube:admin",
      "server": "https://api.ww-cai-cisco-live.dcloud.local:6443"
    }
  },
  "captured_at": "2026-10-13T06:42:53.313696+00:00",
  "cleanup": {
    "failures": [],
    "status": "PASS"
  },
  "errors": [],
  "filters": {},
  "kind": "create_selfhosted_runner",
  "operation": "update",
  "plan_digest": "5a9b4dbbf265dca74a063a5325934575ee0745ee4cf28528caaef610ffe05787",
  "records": [
    {
      "callback": "EnsureNamespace",
      "namespaces": [
        {
          "action": "NO_OP",
          "name": "ci-skills-pr67-a9ef7ff4",
          "uid": "cd7a25df-314b-43f4-a6e6-31bbf1719b6c"
        }
      ],
      "verified": true
    },
    {
      "app": "ci-skills-toolbox-pr67",
      "build_fingerprint": "3c74d722c519d1416015013c2f941cb6eac6a23d17c765184273ef6e257a05d8",
      "build_name": null,
      "callback": "HarborBuild",
      "digest": "sha256:ca1f0ba6940496d537c11e76b18c03138d3293f47fc1ea81c18426df2e7f1789",
      "image": "harbor.dcloud.run/hott/ci-skills-toolbox:ci-skills-build-4f1c1f8729dec1b999b26c83",
      "namespace": "ci-skills-pr67-a9ef7ff4",
      "reused": true,
      "specification_fingerprint": "4f1c1f8729dec1b999b26c836c3eff94edc98e49e36dad95d1cb3cef85af1a91",
      "verified": true
    },
    {
      "action": "NO_OP",
      "callback": "HarborPush",
      "digest": "sha256:ca1f0ba6940496d537c11e76b18c03138d3293f47fc1ea81c18426df2e7f1789",
      "image": "harbor.dcloud.run/hott/ci-skills-toolbox@sha256:ca1f0ba6940496d537c11e76b18c03138d3293f47fc1ea81c18426df2e7f1789",
      "verified": true
    },
    {
      "action": "VERIFIED",
      "callback": "PullImage",
      "image": "harbor.dcloud.run/hott/ci-skills-toolbox@sha256:ca1f0ba6940496d537c11e76b18c03138d3293f47fc1ea81c18426df2e7f1789",
      "pods": [
        {
          "image_id": "harbor.dcloud.run/hott/ci-skills-toolbox@sha256:ca1f0ba6940496d537c11e76b18c03138d3293f47fc1ea81c18426df2e7f1789",
          "name": "ci-skills-pr67-a9ef7ff4-pull-hjsg8"
        }
      ],
      "verified": true
    },
    {
      "action": "NO_OP",
      "callback": "DeployRunner",
      "image": "harbor.dcloud.run/hott/ci-skills-toolbox@sha256:ca1f0ba6940496d537c11e76b18c03138d3293f47fc1ea81c18426df2e7f1789",
      "name": "ci-skills-pr67-a9ef7ff4",
      "namespace": "ci-skills-pr67-a9ef7ff4",
      "pods": [
        {
          "image_id": "harbor.dcloud.run/hott/ci-skills-toolbox@sha256:ca1f0ba6940496d537c11e76b18c03138d3293f47fc1ea81c18426df2e7f1789",
          "name": "ci-skills-pr67-a9ef7ff4-67c755dcdb-n88zw"
        }
      ],
      "resources": [
        {
          "action": "NO_OP",
          "kind": "Secret",
          "name": "ci-skills-pr67-a9ef7ff4-registry",
          "namespace": "ci-skills-pr67-a9ef7ff4",
          "uid": "554e1acd-8f09-4237-9e75-eae3b7679169"
        },
        {
          "action": "NO_OP",
          "kind": "Secret",
          "name": "ci-skills-pr67-a9ef7ff4-registration",
          "namespace": "ci-skills-pr67-a9ef7ff4",
          "uid": "f89ef496-d9b1-496d-a551-9d1b8be126b5"
        },
        {
          "action": "NO_OP",
          "kind": "Deployment",
          "name": "ci-skills-pr67-a9ef7ff4",
          "namespace": "ci-skills-pr67-a9ef7ff4",
          "uid": "39e1c123-09f0-4bb0-8de1-d33192a20be8"
        }
      ],
      "verified": true
    },
    {
      "action": "NO_OP",
      "busy": false,
      "callback": "CreateGitHubRunner",
      "image": "harbor.dcloud.run/hott/ci-skills-toolbox@sha256:ca1f0ba6940496d537c11e76b18c03138d3293f47fc1ea81c18426df2e7f1789",
      "labels": [
        "Linux",
        "X64",
        "ci-skills",
        "pr67",
        "self-hosted"
      ],
      "name": "ci-skills-pr67-a9ef7ff4",
      "namespace": "ci-skills-pr67-a9ef7ff4",
      "pods": [
        {
          "image_id": "harbor.dcloud.run/hott/ci-skills-toolbox@sha256:ca1f0ba6940496d537c11e76b18c03138d3293f47fc1ea81c18426df2e7f1789",
          "name": "ci-skills-pr67-a9ef7ff4-67c755dcdb-n88zw"
        }
      ],
      "repository": "spyroot/ci-skills",
      "repository_id": 1400051889,
      "resources": [
        {
          "action": "NO_OP",
          "kind": "Secret",
          "name": "ci-skills-pr67-a9ef7ff4-registry",
          "namespace": "ci-skills-pr67-a9ef7ff4",
          "uid": "554e1acd-8f09-4237-9e75-eae3b7679169"
        },
        {
          "action": "NO_OP",
          "kind": "Secret",
          "name": "ci-skills-pr67-a9ef7ff4-registration",
          "namespace": "ci-skills-pr67-a9ef7ff4",
          "uid": "f89ef496-d9b1-496d-a551-9d1b8be126b5"
        },
        {
          "action": "NO_OP",
          "kind": "Deployment",
          "name": "ci-skills-pr67-a9ef7ff4",
          "namespace": "ci-skills-pr67-a9ef7ff4",
          "uid": "39e1c123-09f0-4bb0-8de1-d33192a20be8"
        }
      ],
      "runner_id": 22,
      "status": "online",
      "verified": true
    }
  ],
  "schema_version": "1.0",
  "skill": {
    "algorithm": "sha256-tree-v1",
    "consuming_project": {
      "commit": null,
      "source": null
    },
    "digest": "ff9ebce1733492ac83a6e49a5c630260367c526d604142b761ea52d27be1aef8",
    "file_count": 139,
    "functional_digest": "37a22309da7bd79cc36ca1da4549f713cec7cf0a8f36ebf128bbfc6602a9461e",
    "revision": {
      "source": "installer_record",
      "value": "a9ef7ff49dbed26726f327a19485a9ab801fc9d7",
      "verified": true
    }
  },
  "status": "PASS",
  "summary": {
    "error_count": 0,
    "record_count": 6
  },
  "target": "path:5e5380df1eda",
  "tested_revision": "a9ef7ff49dbed26726f327a19485a9ab801fc9d7",
  "trace_artifact": "../traces/11.jsonl"
}
