{
  "access": {
    "harbor": {
      "credential_source": "file:path:1f8b6bf528f9",
      "granted_actions": [
        "delete",
        "pull",
        "push"
      ],
      "identity": "spyroot",
      "origin": "https://harbor.dcloud.run",
      "repository": "hott/ci-skills-toolbox"
    },
    "kubernetes": {
      "context": "default/api-ww-cai-cisco-live-dcloud-local:6443/kube:admin",
      "identity": "kube:admin",
      "server": "https://api.ww-cai-cisco-live.dcloud.local:6443"
    }
  },
  "captured_at": "2026-10-13T06:48:24.030955+00:00",
  "cleanup": {
    "failures": [],
    "status": "PASS"
  },
  "errors": [],
  "filters": {},
  "kind": "toolbox",
  "operation": "delete",
  "plan_digest": "85d5bc1b1a9bbc942c0a77acf259978ccbbf47f27f1a1f6d3e79913a8bf5f4ea",
  "records": [
    {
      "action": "APPLIED",
      "callback": "DeleteToolbox",
      "name": "ci-skills-toolbox-pr67",
      "namespace": "ci-skills-pr67-a9ef7ff4",
      "verified": true
    }
  ],
  "schema_version": "1.0",
  "skill": {
    "algorithm": "sha256-tree-v1",
    "consuming_project": {
      "commit": null,
      "source": null
    },
    "digest": "ff9ebce1733492ac83a6e49a5c630260367c526d604142b761ea52d27be1aef8",
    "file_count": 139,
    "functional_digest": "37a22309da7bd79cc36ca1da4549f713cec7cf0a8f36ebf128bbfc6602a9461e",
    "revision": {
      "source": "installer_record",
      "value": "a9ef7ff49dbed26726f327a19485a9ab801fc9d7",
      "verified": true
    }
  },
  "status": "PASS",
  "summary": {
    "error_count": 0,
    "record_count": 1
  },
  "target": "path:5e5380df1eda",
  "tested_revision": "a9ef7ff49dbed26726f327a19485a9ab801fc9d7",
  "trace_artifact": "../traces/36.jsonl"
}
