{
  "access": {
    "github": {
      "credential_source": "gh-credential-store:github.com",
      "host": "github.com",
      "identity": "spyroot",
      "repository": "spyroot/ci-skills",
      "repository_id": 1400051889
    },
    "kubernetes": {
      "context": "default/api-ww-cai-cisco-live-dcloud-local:6443/kube:admin",
      "identity": "kube:admin",
      "server": "https://api.ww-cai-cisco-live.dcloud.local:6443"
    }
  },
  "captured_at": "2026-10-13T06:44:16.422435+00:00",
  "cleanup": {
    "failures": [],
    "status": "PASS"
  },
  "errors": [],
  "filters": {},
  "kind": "create_selfhosted_runner",
  "operation": "delete",
  "plan_digest": "106e4f30ad2e486906887f4ed845c2e5f93d926736482617ed4cb8108cde2ba2",
  "records": [
    {
      "action": "APPLIED",
      "callback": "DeleteRunner",
      "name": "ci-skills-pr67-a9ef7ff4",
      "namespace": "ci-skills-pr67-a9ef7ff4",
      "verified": true
    },
    {
      "action": "APPLIED",
      "callback": "DeleteGitHubRunner",
      "name": "ci-skills-pr67-a9ef7ff4",
      "repository": "spyroot/ci-skills",
      "verified": true
    }
  ],
  "schema_version": "1.0",
  "skill": {
    "algorithm": "sha256-tree-v1",
    "consuming_project": {
      "commit": null,
      "source": null
    },
    "digest": "ff9ebce1733492ac83a6e49a5c630260367c526d604142b761ea52d27be1aef8",
    "file_count": 139,
    "functional_digest": "37a22309da7bd79cc36ca1da4549f713cec7cf0a8f36ebf128bbfc6602a9461e",
    "revision": {
      "source": "installer_record",
      "value": "a9ef7ff49dbed26726f327a19485a9ab801fc9d7",
      "verified": true
    }
  },
  "status": "PASS",
  "summary": {
    "error_count": 0,
    "record_count": 2
  },
  "target": "path:5e5380df1eda",
  "tested_revision": "a9ef7ff49dbed26726f327a19485a9ab801fc9d7",
  "trace_artifact": "../traces/10.jsonl"
}
